{
  "$schema": "https://jami.studio/schemas/renderer/presentation-fixture.schema.json",
  "panelId": "evidencePacket.ready",
  "kind": "evidencePacket",
  "harnessSchemaId": "https://jami.studio/schemas/harness/evidence-packet.schema.json",
  "expectedPresentationStatus": "ready",
  "ref": {
    "schemaVersion": "2026-06-09",
    "evidenceId": "ev_contract_generation",
    "subject": "Harness contract generation and validation",
    "freshnessClass": "current_run",
    "source": {
      "repo": "jami-harness",
      "commit": "working-tree",
      "recordedAt": "2026-06-09T12:00:00.000Z"
    },
    "commands": [
      { "command": "pnpm contracts:validate", "status": "passed", "recordedAt": "2026-06-09T12:00:00.000Z", "evidenceRef": "ev_contract_generation" }
    ],
    "artifacts": [
      { "artifactId": "art_contract_reference", "path": "packages/contracts/generated/reference.json", "kind": "generated_reference" }
    ],
    "redaction": { "containsSecrets": false, "privatePayloadPolicy": "none" },
    "acceptedContracts": ["evidencePacket", "runEvent"]
  }
}
