{
  "$schema": "https://jami.studio/schemas/renderer/presentation-fixture.schema.json",
  "panelId": "contextPack.ready",
  "kind": "memoryContext",
  "harnessSchemaId": "https://jami.studio/schemas/harness/context-pack.schema.json",
  "expectedPresentationStatus": "ready",
  "ref": {
    "schemaVersion": "2026-06-09",
    "contextPackId": "ctx_stream4_foundation",
    "runId": "run_stream4_foundation",
    "assembledAt": "2026-06-09T12:00:00.000Z",
    "deterministicHash": "sha256:fixture",
    "items": [
      {
        "sourceRef": "mem_stream4_contract_note",
        "kind": "retrieved",
        "priority": 10,
        "inclusionReason": "permission and query matched",
        "citationId": "cit_stream4_contract_note",
        "freshnessClass": "current_run",
        "tokenEstimate": 10
      }
    ],
    "droppedItems": [
      {
        "sourceRef": "mem_secret_adjacent_note",
        "reason": "permission_denied"
      }
    ]
  }
}
